composers	title	key	tempo	style	checked	in_progress	Notes	turnaround	marked_	chords
Rowles, Jimmy	502 Blues	a	100	Jazz-Medium Swing	TRUE	TRUE		0	|Am7|Db^7|B%7|E7|Am7|Db^7|B%7|E7|Cm7|F7|Bb^7|Abm7 Db7|F#%7|B7|E^7|E^7 E7|Am7|Db^7|B%7|E7|Am7|Db^7|B%7|E7|Cm7|F7|Bb^7|Abm7 Db7|F#%7|B7|Em7|Em7|	Am7, Db^7, B%7, E7, Am7, Db^7, B%7, E7, Cm7, F7, Bb^7, Abm7, Db7, F#%7, B7, E^7, E^7, E7, Am7, Db^7, B%7, E7, Am7, Db^7, B%7, E7, Cm7, F7, Bb^7, Abm7, Db7, F#%7, B7, Em7, Em7
Greene, Joe	Across The Valley From The Alamo	F	100	Jazz-Medium Swing	TRUE	TRUE		0	|F^7|F^7|F^7|F^7|C7|C7|Gm7 C7|F^7|F^7|F^7|F^7|F^7|C7|C7|Gm7 C7|F^7|Bb^7|F^7|Bb^7 Bbm7|F^7|A7|Dm7 G7|G7|C7|F^7|F^7|F^7|F^7|C7|C7|Gm7 C7|F^7|	F^7, F^7, F^7, F^7, C7, C7, Gm7, C7, F^7, F^7, F^7, F^7, F^7, C7, C7, Gm7, C7, F^7, Bb^7, F^7, Bb^7, Bbm7, F^7, A7, Dm7, G7, G7, C7, F^7, F^7, F^7, F^7, C7, C7, Gm7, C7, F^7
Santamaria, Mongo	Afro Blue	f	100	Jazz-Medium Up Swing	TRUE	TRUE		0	|Fm7|Gm7|Ab^7 Gm7|Fm7|Fm7|Gm7|Ab^7 Gm7|Fm7|Eb^|Eb^|Db^ Eb^|Fm7|Eb^|Eb^|Db^ Eb^|Fm7|	Fm7, Gm7, Ab^7, Gm7, Fm7, Fm7, Gm7, Ab^7, Gm7, Fm7, Eb^, Eb^, Db^, Eb^, Fm7, Eb^, Eb^, Db^, Eb^, Fm7
Marks, Gerald	All Of Me	C	100	Jazz-Medium Swing	TRUE	TRUE		3	|C^7|C^7|E7|E7|A7|A7|Dm7|Dm7|E7|E7|Am7|Am7|D7|D7|Dm7|G7|C^7|C^7|E7|E7|A7|A7|Dm7|Dm7|F^7|Fm6|Em7|A7|Dm7|G7|C6 Ebo7|Dm7 G7|	C^7, C^7, E7, E7, A7, A7, Dm7, Dm7, E7, E7, Am7, Am7, D7, D7, Dm7, G7, C^7, C^7, E7, E7, A7, A7, Dm7, Dm7, F^7, Fm6, Em7, A7, Dm7, G7, C6, Ebo7, Dm7, G7
Corea, Chick	Armando's Rhumba	c	180	Jazz-Latin	TRUE	TRUE		1	|Cm7|D7|G7|Cm7|Cm7|D7|G7|Cm7|C7|Fm7|D7|Gm7|Abo7|D7|Bbsus|Bbsus|Bbsus|Bbsus|Eb6&Eb6&Eb6&Eb6|G7|	Cm7, D7, G7, Cm7, Cm7, D7, G7, Cm7, C7, Fm7, D7, Gm7, Abo7, D7, Bbsus, Bbsus, Bbsus, Bbsus, Eb6, Eb6, Eb6, Eb6, G7
Kosma, Joseph	Autumn Leaves	g	100	Jazz-Medium Swing	TRUE	TRUE		0	|Cm7|F7|Bb^7|Eb^7|A%7|D7|Gm6|Gm6|Cm7|F7|Bb^7|Eb^7|A%7|D7|Gm6|Gm6|A%7|D7|Gm6|Gm6|Cm7|F7|Bb^7|Bb^7|A%7|D7|Gm7 Gb7|Fm7 E7|A%7|D7|Gm6|Gm6|	Cm7, F7, Bb^7, Eb^7, A%7, D7, Gm6, Gm6, Cm7, F7, Bb^7, Eb^7, A%7, D7, Gm6, Gm6, A%7, D7, Gm6, Gm6, Cm7, F7, Bb^7, Bb^7, A%7, D7, Gm7, Gb7, Fm7, E7, A%7, D7, Gm6, Gm6
Jolson, Al & DeSylva, Buddy & Rose, Vincent	Avalon	B-	240	Jazz-Up Tempo Swing	TRUE	TRUE		0	|Cm7|Cm7|F7|F7|Bb6|Bb6|Bb6|G7|Cm7|Cm7|F7|F7|Bb6|Bb6|Bb6|Bb6|Dm7|Dm7|G7|G7|Cm7|Cm7|Ebm7|Ab7|Bb6|Bb6|G7|G7|Cm7|F7|Bb6|Bb6|	Cm7, Cm7, F7, F7, Bb6, Bb6, Bb6, G7, Cm7, Cm7, F7, F7, Bb6, Bb6, Bb6, Bb6, Dm7, Dm7, G7, G7, Cm7, Cm7, Ebm7, Ab7, Bb6, Bb6, G7, G7, Cm7, F7, Bb6, Bb6
Shorter, Wayne	Backstage Sally	f	100	Jazz-Medium Swing	TRUE	TRUE		3	|Fm6 D7|G7 C7|Ebm7 Ab7|Cm7 F7|Bbm6 Ab7|G7 Gb7|Fm7 Bb7|Ebm7 Ab7|D7 G7|C7 F7|Bb7 Eb7|G%7 C7|Fm6 D7|G7 C7|Fm7 Ab7|Db^ Gb7|	Fm6, D7, G7, C7, Ebm7, Ab7, Cm7, F7, Bbm6, Ab7, G7, Gb7, Fm7, Bb7, Ebm7, Ab7, D7, G7, C7, F7, Bb7, Eb7, G%7, C7, Fm6, D7, G7, C7, Fm7, Ab7, Db^, Gb7
Parker, Charlie	Ballade	F	60	Jazz-Ballad Swing	TRUE	TRUE		0		Cm7, F7, Bb^7, Bbm7, Eb7, Ab^7, Dm7, G7, Dm7, Dm7, G7, Gm7, D7, Gm7, C7, F^7, Dm7, A7, D7, D7, G7, G%7, C7, F6, F6
Wright, Robert & Forrest, George	Baubles, Bangles And Beads	A-	100	Jazz-Medium Swing	TRUE	TRUE		0	|Bbm7|Eb7|Cm7|Fm7|Bbm7|Eb7|Ab^7|Ab^7|Dm7|G7|Em7|Am7|Dm7|G7|C^7|C^7|F#m7|B7|E^7|E^7|Bbm7|Eb7|Cm7|F7|Bbm7|Eb7|Cm7|F7|Bbm7|Eb7|Gb7|F7|Bbm7|Eb7|Ab^7|Ab^7|	Bbm7, Eb7, Cm7, Fm7, Bbm7, Eb7, Ab^7, Ab^7, Dm7, G7, Em7, Am7, Dm7, G7, C^7, C^7, F#m7, B7, E^7, E^7, Bbm7, Eb7, Cm7, F7, Bbm7, Eb7, Cm7, F7, Bbm7, Eb7, Gb7, F7, Bbm7, Eb7, Ab^7, Ab^7
Rivers, Sam	Beatrice	F	100	Jazz-Medium Swing	TRUE	TRUE		1	|F^7|Gb^7|F^7|Eb^7|Dm7|Eb^7|Dm7 Cm7|Bbm7|Am7|Bb^7|E%7 A7|Dm7|Gm7|Gb^7|Fm7|Gb^7|	F^7, Gb^7, F^7, Eb^7, Dm7, Eb^7, Dm7, Cm7, Bbm7, Am7, Bb^7, E%7, A7, Dm7, Gm7, Gb^7, Fm7, Gb^7
Kahn, Donald	Beautiful Friendship, A	A-	100	Jazz-Medium Swing	TRUE	TRUE		3	|C^7|Gb7|F^7|E%7 A7|Am7|D7|Dm7|G7|C^7|Gb7|F^7|E%7 A7|Am7|D7|Dm7|G7|Gm7|C7|F^7|Bb7|Em7|A7|D7|G7|C^7|Gb7|F^7|E%7 A7|Dm7|G7|C6 A7|D7 G7|	C^7, Gb7, F^7, E%7, A7, Am7, D7, Dm7, G7, C^7, Gb7, F^7, E%7, A7, Am7, D7, Dm7, G7, Gm7, C7, F^7, Bb7, Em7, A7, D7, G7, C^7, Gb7, F^7, E%7, A7, Dm7, G7, C6, A7, D7, G7
Young, Victor	Beautiful Love	d	100	Jazz-Medium Swing	TRUE	TRUE		0	|E%7|A7|Dm|Dm|Gm7|C7|F^7|E%7 A7|Dm|Gm7|Bb7|A7|Dm|G7|E%7|A7|E%7|A7|Dm|Dm|Gm7|C7|F^7|E%7 A7|Dm|Gm7|Bb7|A7|Dm B7|Bb7 A7|Dm|Dm|	E%7, A7, Dm, Dm, Gm7, C7, F^7, E%7, A7, Dm, Gm7, Bb7, A7, Dm, G7, E%7, A7, E%7, A7, Dm, Dm, Gm7, C7, F^7, E%7, A7, Dm, Gm7, Bb7, A7, Dm, B7, Bb7, A7, Dm, Dm
Monk, Thelonious	Bemsha Swing	C	100	Jazz-Medium Swing	TRUE	TRUE		2	|C^ A7|Ab7 Db7|C^ Eb7|D7 Db7|C^ A7|Ab7 Db7|C^ Ab7|Db7 Gb7|F^ D7|Db7 Gb7|F^ Ab7|G7 Db7|C^ A7|Ab7 Db7|C^ Db^7|Db^7|	C^, A7, Ab7, Db7, C^, Eb7, D7, Db7, C^, A7, Ab7, Db7, C^, Ab7, Db7, Gb7, F^, D7, Db7, Gb7, F^, Ab7, G7, Db7, C^, A7, Ab7, Db7, C^, Db^7, Db^7
DeSylva, B.G. & Brown, Lew & Henderson, Ray	Best Things In Life Are Free, The	C	160	Jazz-Medium Up Swing	TRUE	TRUE		0	|C6|C6|C^7|C^7|C6|C6 Ebo7|Dm7|G7|Dm7|Dm7|Dm7|Dm7|G7|Dm7 G7|C^7 C#o7|Dm7 G7|C7|C7|F^7|F^7|D7|D7|Dm7|G7|C6|C6|Em7|A7|Dm7|Dm7 G7|C6|C6|	C6, C6, C^7, C^7, C6, C6, Ebo7, Dm7, G7, Dm7, Dm7, Dm7, Dm7, G7, Dm7, G7, C^7, C#o7, Dm7, G7, C7, C7, F^7, F^7, D7, D7, Dm7, G7, C6, C6, Em7, A7, Dm7, Dm7, G7, C6, C6
Traditional	Bill Bailey	G	160	Jazz-Medium Up Swing	TRUE	TRUE		2	|G^|G^|G^|G^|G^|G^ Abo7|Am7|D7|D7|D7|D7|D7|D7|D7|G^|Am7 D7|G^|G^|G^|G^|Dm7|G7|C^|C^|C^|C#o7|G^|E7|A7|D7|G^|Am7 D7|	G^, G^, G^, G^, G^, G^, Abo7, Am7, D7, D7, D7, D7, D7, D7, D7, G^, Am7, D7, G^, G^, G^, G^, Dm7, G7, C^, C^, C^, C#o7, G^, E7, A7, D7, G^, Am7, D7
Gillespie, Dizzy	Birk's Works	f	240	Jazz-Up Tempo Swing	TRUE	TRUE		0	|Fm6|G%7 C7|Fm6|C%7 F7|Bbm7|Bbm7|Fm6|Fm6|Abm7 Db7|G%7 C7|Fm6|Fm6|	Fm6, G%7, C7, Fm6, C%7, F7, Bbm7, Bbm7, Fm6, Fm6, Abm7, Db7, G%7, C7, Fm6, Fm6
Dorham, Kenny	Blue Bossa	c	140	Jazz-Bossa Nova	TRUE	TRUE		2	|Cm7|Cm7|Fm7|Fm7|D%7|G7|Cm7|Cm7|Ebm7|Ab7|Db^7|Db^7|D%7|G7|Cm7|D%7 G7|	Cm7, Cm7, Fm7, Fm7, D%7, G7, Cm7, Cm7, Ebm7, Ab7, Db^7, Db^7, D%7, G7, Cm7, D%7, G7
Davis, Miles & Evans, Bill	Blue In Green	d	60	Jazz-Ballad Swing	TRUE	TRUE	Coda Review	0	|Gm6|A7|Dm7 Db7|Cm7 F7|Bb^7|A7|Dm6|E7|Am7|Dm7|Gm6|A7|Dm6|Dm6|	Gm6, A7, Dm7, Db7, Cm7, F7, Bb^7, A7, Dm6, E7, Am7, Dm7, Gm6, A7, Dm6, Dm6
Mills, Irving	Blue Lou	B-	100	Jazz-Medium Swing	TRUE	TRUE		0	|C%7|F7|C%7|F7|Bb^7|Eb^7|Cm7|F7|C%7|F7|C%7|F7|Bb^7|Eb^7|C7 F7|Bb^7|F^7|F#o7|Gm7|C7|F^7|F#o7|Gm7 C7|F7|C%7|F7|C%7|F7|Bb^7|Eb^7|C7 F7|Bb^7|	C%7, F7, C%7, F7, Bb^7, Eb^7, Cm7, F7, C%7, F7, C%7, F7, Bb^7, Eb^7, C7, F7, Bb^7, F^7, F#o7, Gm7, C7, F^7, F#o7, Gm7, C7, F7, C%7, F7, C%7, F7, Bb^7, Eb^7, C7, F7, Bb^7
Parker, Charlie	Blues For Alice	F	160	Jazz-Medium Up Swing	TRUE	TRUE		-1	|F^7|E%7 A7|Dm7 G7|Cm7 F7|Bb7|Bbm7 Eb7|Am7 D7|Abm7 Db7|Gm7|C7|F7 D7|Gm7 C7|	F^7, E%7, A7, Dm7, G7, Cm7, F7, Bb7, Bbm7, Eb7, Am7, D7, Abm7, Db7, Gm7, C7, F7, D7, Gm7, C7
Shaw, Woody	Blues For Wood	f	240	Jazz-up Tempo Swing	TRUE	TRUE	C7#9	NT	|Fm7|Fm7|Fm7|Fm7|Db7|Db7|Fm7|Fm7|Db7|Bb^7|G%7 C7|Fm7|	Fm7, Fm7, Fm7, Fm7, Db7, Db7, Fm7, Fm7, Db7, Bb^7, G%7, C7, Fm7
Thielemans, Toots	Bluesette	B-	100	Jazz-Medium Swing	TRUE	TRUE		-1	|Bb^7|Bb^7|A%7|D7|Gm7|C7|Fm7|Bb7|Eb^7|Eb^7|Ebm7|Ab7|Db^7|Db^7|C#m7|F#7|B^7|B^7|Cm7|F7|Dm7|G7|Cm7|F7|	Bb^7, Bb^7, A%7, D7, Gm7, C7, Fm7, Bb7, Eb^7, Eb^7, Ebm7, Ab7, Db^7, Db^7, C#m7, F#7, B^7, B^7, Cm7, F7, Dm7, G7, Cm7, F7
Monk, Thelonious	Boo Boo's Birthday	C	100	Jazz-Medium Swing	TRUE	TRUE		0	|C^7|B7|E7|E7|F7 E7|Eb7 D7|Db^7|Db7|C^7|B7|E7|E7|F7 E7|Eb7 D7|Db^7|Db7|Gm7|Db7 Gb7|F^7|C^7|F^7 C^7|	C^7, B7, E7, E7, F7, E7, Eb7, D7, Db^7, Db7, C^7, B7, E7, E7, F7, E7, Eb7, D7, Db^7, Db7, Gm7, Db7, Gb7, F^7, C^7, F^7, C^7
Little, Booker	Booker's Waltz	A-	100	Jazz-Medium Swing	TRUE	TRUE		2	|Ab^7|Eb7|G%7|C7|Fm7|Db7|Bb7|Db7|Ab^7|B7|Bbm7|Eb7|Ab^7|Ab^7|A7|A7|	Ab^7, Eb7, G%7, C7, Fm7, Db7, Bb7, Db7, Ab^7, B7, Bbm7, Eb7, Ab^7, Ab^7, A7, A7
Desmond, Paul	Bossa Antigua	A-	140	Jazz-Bossa Nova	TRUE	TRUE		0	|Bbm7|Eb7|Cm7|Fm7|Bbm7|Eb7|Cm7|F7|Bbm7|Eb7|Cm7|Fm7|Bbm7|Dm7 G7|C^7|Am7|Dm7|G7|Em7|Am7|Dm7|G7|Cm7|F7|Bbm7|Eb7|Cm7|Fm7|Bbm7|Eb7|Ab^7|Ab^7|	Bbm7, Eb7, Cm7, Fm7, Bbm7, Eb7, Cm7, F7, Bbm7, Eb7, Cm7, Fm7, Bbm7, Dm7, G7, C^7, Am7, Dm7, G7, Em7, Am7, Dm7, G7, Cm7, F7, Bbm7, Eb7, Cm7, Fm7, Bbm7, Eb7, Ab^7, Ab^7
Martin, Hugh & Blane, Ralph	Boy Next Door	C	100	Jazz-Medium Swing	TRUE	TRUE		0	|Bb^7|G7|Cm7|F7|Bb^7|Gm7|C7|C7|Cm7|F7|Bb^7|Gm7|E%7|A7|Dm7 Db7|Cm7 F7|Bb^7|G7|Cm7|F7|Bb^7|Gm7|C7|B7|Bb^7|Bb^7|E%7|C7|Gb7|F7|Bb^7|Bb^7|	Bb^7, G7, Cm7, F7, Bb^7, Gm7, C7, C7, Cm7, F7, Bb^7, Gm7, E%7, A7, Dm7, Db7, Cm7, F7, Bb^7, G7, Cm7, F7, Bb^7, Gm7, C7, B7, Bb^7, Bb^7, E%7, C7, Gb7, F7, Bb^7, Bb^7
Monk, Thelonious	Bright Mississippi	A-	240	Jazz-Up Tempo Swing	TRUE	TRUE		0	|F7|F7|F7|F7|Bb7|Bb7|Bb7|Bb7|Eb7|Eb7|Eb7|Eb7|Ab^7|Ab^7|G%7|C7|F7|F7|F7|F7|Bb7|Bb7|Bb7|Bb7|Fm|C7|Fm|C7|Ab^7|F7|Bbm7 Eb7|Ab6|	F7, F7, F7, F7, Bb7, Bb7, Bb7, Bb7, Eb7, Eb7, Eb7, Eb7, Ab^7, Ab^7, G%7, C7, F7, F7, F7, F7, Bb7, Bb7, Bb7, Bb7, Fm, C7, Fm, C7, Ab^7, F7, Bbm7, Eb7, Ab6
Woode, William Henri & Bird, Bill & McRae, Teddy	Broadway	B-	160	Jazz-Medium Up Swing	TRUE	TRUE		0	|Bb^7|Bb^7|Eb7|Eb7|Cm7|F7|Bb^7 G7|Cm7 F7|Bb^7|Bb^7|Eb7|Eb7|Cm7|F7|Bb6|Bb6|Fm7|Bb7|Eb^7|Eb^7|Ebm7|Ab7|Db7|Gb7 F7|Bb^7|Bb^7|Eb7|Eb7|Cm7|F7|Bb6|Bb6|	Bb^7, Bb^7, Eb7, Eb7, Cm7, F7, Bb^7, G7, Cm7, F7, Bb^7, Bb^7, Eb7, Eb7, Cm7, F7, Bb6, Bb6, Fm7, Bb7, Eb^7, Eb^7, Ebm7, Ab7, Db7, Gb7, F7, Bb^7, Bb^7, Eb7, Eb7, Cm7, F7, Bb6, Bb6
Loesser, Frank	Brotherhood Of Man	E-	160	Jazz-Medium Up Swing	TRUE	TRUE		1	|Eb^|Eb^|Eb^|Eb^|Eb^ Fm7|Gm7 C7|F7|Bb7|Eb^|Eb^|Ab7|Co7|Gm7 C7|Fm7 Bb7|Eb^|Bb7|	Eb^, Eb^, Eb^, Eb^, Eb^, Fm7, Gm7, C7, F7, Bb7, Eb^, Eb^, Ab7, Co7, Gm7, C7, Fm7, Bb7, Eb^, Bb7
Mack David & Joan Whitney & Alex Kramer	Candy	B-	100	Jazz-Medium Swing	TRUE	TRUE		0	|Eb^7|Ebm6|Dm7|Dbo7|Cm7|F7|Bb6|Fm7 Bb7|Eb^7|Ebm6|Dm7|Dbo7|Cm7|F7|Bb6 Eb7|Bb6|Am7|D7|Dm7|G7|Gm7|C7|Cm7|F7 Bb7|Eb^7|Ebm6|Dm7|Dbo7|Cm7|F7|Bb6 Eb7|Bb6|	Eb^7, Ebm6, Dm7, Dbo7, Cm7, F7, Bb6, Fm7, Bb7, Eb^7, Ebm6, Dm7, Dbo7, Cm7, F7, Bb6, Eb7, Bb6, Am7, D7, Dm7, G7, Gm7, C7, Cm7, F7, Bb7, Eb^7, Ebm6, Dm7, Dbo7, Cm7, F7, Bb6, Eb7, Bb6
Coltrane, John	Central Park West	B	60	Jazz Ballad Swing	TRUE	TRUE		3	|B^7 Em7&A7|D^7 Bbm7&Eb7|Ab^7 Gm7&C7|F^7 C#m7&F#7|B^7 Em7&A7|D^7 C#m7&F#7|B^7|B6|B^7|B6 C#m7&F#7|	B^7, Em7, A7, D^7, Bbm7, Eb7, Ab^7, Gm7, C7, F^7, C#m7, F#7, B^7, Em7, A7, D^7, C#m7, F#7, B^7, B6, B^7, B6, C#m7, F#7
D'Rivera, Paquito	Chucho	d	180	Jazz Latin	TRUE	TRUE		1	|Dm|E%7 A7|Dm|E%7 A7|Dm|E%7 A7|Dm|E%7 A7|Dm|E%7 A7|Dm|D7|Gm Gm7|E%7 A7|Dm Dbm|Cm7 F7|Bb7|E%7 A7|Dm|A7|	Dm, E%7, A7, Dm, E%7, A7, Dm, E%7, A7, Dm, E%7, A7, Dm, E%7, A7, Dm, D7, Gm, Gm7, E%7, A7, Dm, Dbm, Cm7, F7, Bb7, E%7, A7, Dm, A7
Tyner, McCoy	Contemplation	c	100	Jazz-Medium Swing	TRUE	TRUE	Ab^7#11	-1	|Cm7|Cm7|Cm7|Cm7|Cm7|Cm7|Cm7|Cm7|Ab^7|Ab^7|Ab^7|Ab^7|G7|G7|G7|G7|	Cm7, Cm7, Cm7, Cm7, Cm7, Cm7, Cm7, Cm7, Ab^7, Ab^7, Ab^7, Ab^7, G7, G7, G7, G7
Golson, Benny	Cool One, The	G	100	Jazz-Medium Swing	TRUE	TRUE		NT	|Bm7|E7|Bm7|E7|Am7|D7|Am7|D7|Bm7|E7|Bm7|E7|Am7|D7|Am7|D7|G^7|G^7|B%7|E7|C#%7|A%7 D7|G^7|C7|Bm7|E7|Bm7|E7|Am7|D7|Am7|D7|	Bm7, E7, Bm7, E7, Am7, D7, Am7, D7, Bm7, E7, Bm7, E7, Am7, D7, Am7, D7, G^7, G^7, B%7, E7, C#%7, A%7, D7, G^7, C7, Bm7, E7, Bm7, E7, Am7, D7, Am7, D7
Jobim, Antonio Carlos	Corcovado	C	140	Jazz-Bossa Nova	TRUE	TRUE		NT	|Am6|Am6|Abo7|Abo7|Gm7|C7|F^7 F^7|F^7|Fm7|Bb7|Em7|A7|D7|D7|Dm7|G7|Am6|Am6|Abo7|Abo7|Gm7|C7|F^7 F^7|F^7|Fm7|Bb7|Em7|Am7|Dm7|G7|Em7|A7|Dm7|G7|C6|C6|	Am6, Am6, Abo7, Abo7, Gm7, C7, F^7, F^7, F^7, Fm7, Bb7, Em7, A7, D7, D7, Dm7, G7, Am6, Am6, Abo7, Abo7, Gm7, C7, F^7, F^7, F^7, Fm7, Bb7, Em7, Am7, Dm7, G7, Em7, A7, Dm7, G7, C6, C6
Schwartz, Arthur	Dancing In The Dark	C	100	Jazz-Medium Swing	TRUE	TRUE		2	|C^7|C^7|Co7|Co7|Dm7|Dm7|D%7|G7|C^7|Cm7|E%7|A7|D%7|D%7|D%7 Ab7|G7|C^7|C^7|Co7|Co7|Dm7|Dm7|D%7|D%7 G7|C^7|Cm7|Eb7|Db7|C6|D%7 Gsus|C6|Dm7 G7|	C^7, C^7, Co7, Co7, Dm7, Dm7, D%7, G7, C^7, Cm7, E%7, A7, D%7, D%7, D%7, Ab7, G7, C^7, C^7, Co7, Co7, Dm7, Dm7, D%7, D%7, G7, C^7, Cm7, Eb7, Db7, C6, D%7, Gsus, C6, Dm7, G7
Kern, Jerome	Dearly Beloved	C	100	Jazz-Medium Swing	TRUE	TRUE		2	|Dm7|G7|Dm7|G7|Dm7|G7|Dm7|G7|C6|C6|Dm7|G7|C^7|C^7|Ebm7 Ab7|Ebm7 Ab7|Dm7|G7|Dm7|G7|Dm7|G7|Dm7|G7|C6|C6|D7|D7|Dm7|G7|C6|Em7 A7|	Dm7, G7, Dm7, G7, Dm7, G7, Dm7, G7, C6, C6, Dm7, G7, C^7, C^7, Ebm7, Ab7, Ebm7, Ab7, Dm7, G7, Dm7, G7, Dm7, G7, Dm7, G7, C6, C6, D7, D7, Dm7, G7, C6, Em7, A7
Bloom, Rube	Don't Worry 'Bout Me	A-	60	Jazz-Ballad Swing	TRUE	TRUE		2	|Bbm7|Eb7|Ab^7|Ab^7|Bbm7|Eb7|Ab6|Cm7 Bo7|Bbm7|Dbm6|Gb7|Gb7 G%7&C7|Fm7|Bb7|Bbm7|Eb7|Bbm7|Eb7|Ab^7|Ab^7|Ab^7|Ebm7 Ab7|Db^7|Db^7|Db^7|Gb7|Cm7|F7|Bbm7|Eb7|Ab6|Cm7 F7|	Bbm7, Eb7, Ab^7, Ab^7, Bbm7, Eb7, Ab6, Cm7, Bo7, Bbm7, Dbm6, Gb7, Gb7, G%7, C7, Fm7, Bb7, Bbm7, Eb7, Bbm7, Eb7, Ab^7, Ab^7, Ab^7, Ebm7, Ab7, Db^7, Db^7, Db^7, Gb7, Cm7, F7, Bbm7, Eb7, Ab6, Cm7, F7
Charlie, Parker	Donna Lee	A-	240	Jazz-Up Tempo Swing	TRUE	TRUE		2	|Ab^7|F7|Bb7|Bb7|Bbm7|Eb7|Ab^7|Ebm7 Ab7|Db^7|Gb7|Ab^7|F7|Bb7|Bb7|Bbm7|Eb7|Ab^7|F7|Bb7|Bb7|G%7|C7|Fm|C7|Fm|C7|Fm|Bo7|Cm7 F7|Bbm7 Eb7|Ab^7|Bbm7 Eb7|	Ab^7, F7, Bb7, Bb7, Bbm7, Eb7, Ab^7, Ebm7, Ab7, Db^7, Gb7, Ab^7, F7, Bb7, Bb7, Bbm7, Eb7, Ab^7, F7, Bb7, Bb7, G%7, C7, Fm, C7, Fm, C7, Fm, Bo7, Cm7, F7, Bbm7, Eb7, Ab^7, Bbm7, Eb7
Coltrane, John	Equinox	c#	80	Jazz-Slow Swing	TRUE	TRUE		NT	|C#m7|C#m7|C#m7|C#m7|F#m7|F#m7|C#m7|C#m7|A7|G#7|C#m7|C#m7|	C#m7, C#m7, C#m7, C#m7, F#m7, F#m7, C#m7, C#m7, A7, G#7, C#m7, C#m7
McHugh, Jimmy	Exactly Like You	C	100	Jazz-Medium Swing	TRUE	TRUE		2	|C6|C6|D7|D7|G7|G7|C6|Dm7 G7|C6|C6|D7|D7|G7|G7|C6|C7|F^7|Bb7|C6|Am7|Dm7|Fm6 G7|Em7 Ebo7|Dm7 G7|C6|C6|D7|D7|G7|G7|C6|Dm7 G7|	C6, C6, D7, D7, G7, G7, C6, Dm7, G7, C6, C6, D7, D7, G7, G7, C6, C7, F^7, Bb7, C6, Am7, Dm7, Fm6, G7, Em7, Ebo7, Dm7, G7, C6, C6, D7, D7, G7, G7, C6, Dm7, G7
Swift, Kay	Fine And Dandy	F	160	Jazz-Medium Up Swing	TRUE	TRUE		0	|F^7|Abo7|Gm7|C7|F^7|Abo7|Gm7|C7|F7|F7|Bb7|Bb7|Eb7|Eb7|Ab7|Gm7 C7|F^7|Abo7|Gm7|C7|F^7|Abo7|Gm7|C7|Cm7|F7|Bb^7|Bbm7|G7|Gm7 C7|F^7|F^7|	F^7, Abo7, Gm7, C7, F^7, Abo7, Gm7, C7, F7, F7, Bb7, Bb7, Eb7, Eb7, Ab7, Gm7, C7, F^7, Abo7, Gm7, C7, F^7, Abo7, Gm7, C7, Cm7, F7, Bb^7, Bbm7, G7, Gm7, C7, F^7, F^7
Kern, Jerome	Fine Romance, A	C	100	Jazz-Medium Swing	TRUE	TRUE		2	|C6|C#o7|Dm6|D#o7|Em7|Am7|Dm7|G7|C6|Ebo7|Dm7|G7|Em7|A7|D7|G7|C6|C#o7|Dm6|D#o7|Em7|Am7|Dm7|G7|C6|C7|F^7|F#%7 B7|Em7 A7|Dm7 G7|C6|Dm7 G7|	C6, C#o7, Dm6, D#o7, Em7, Am7, Dm7, G7, C6, Ebo7, Dm7, G7, Em7, A7, D7, G7, C6, C#o7, Dm6, D#o7, Em7, Am7, Dm7, G7, C6, C7, F^7, F#%7, B7, Em7, A7, Dm7, G7, C6, Dm7, G7
Bloom, Rube	Fools Rush In	C	80	Jazz-Slow Swing	TRUE	TRUE		3	|Dm7|G7|C^7|Am7|Dm7|G7|C^7|Am7|Dm7|G7|C6|Am7|D7|D7|G7|G7|Dm7|G7|C^7|Am7|Dm7|G7|E%7|A7|Dm7|Fm6|C^7|Am7|Dm7|G7|C6 Am7|Dm7 G7|	Dm7, G7, C^7, Am7, Dm7, G7, C^7, Am7, Dm7, G7, C6, Am7, D7, D7, G7, G7, Dm7, G7, C^7, Am7, Dm7, G7, E%7, A7, Dm7, Fm6, C^7, Am7, Dm7, G7, C6, Am7, Dm7, G7
Shorter, Wayne	Footprints	c	100	Jazz-Medium Swing	TRUE	TRUE		0	|Cm7|Cm7|Cm7|Cm7|Cm7|Cm7|Cm7|Cm7|Fm7|Fm7|Fm7|Fm7|Cm7|Cm7|Cm7|Cm7|D7|D7|Db7|Db7|Cm7|Cm7|Cm7|Cm7|	Cm7, Cm7, Cm7, Cm7, Cm7, Cm7, Cm7, Cm7, Fm7, Fm7, Fm7, Fm7, Cm7, Cm7, Cm7, Cm7, D7, D7, Db7, Db7, Cm7, Cm7, Cm7, Cm7
Montgomery, Wes	Four On Six	g	240	Jazz-Up Tempo Swing	TRUE	TRUE		2	|Gm7|Gm7|Gm7|Gm7|Cm7 F7|Bbm7 Eb7|Am7 D7|Ebm7 Ab7|Gm7|Gm7|Gm7|Cm7 F7|Bb^7 Gm7|Eb7 D7|Gm7|A%7 D7|	Gm7, Gm7, Gm7, Gm7, Cm7, F7, Bbm7, Eb7, Am7, D7, Ebm7, Ab7, Gm7, Gm7, Gm7, Cm7, F7, Bb^7, Gm7, Eb7, D7, Gm7, A%7, D7
Flanagan, Tommy	Freight Train	A-	160	Jazz-Medium Up Swing	TRUE	TRUE		-1	|Ab^7|G%7 C7|Fm7 Em7|Ebm7 Ab7|Db^7|Dbm7 Gb7|Cm7 F7|Bm7 E7|Bbm7|Eb7|Cm7 F7|Bbm7 Eb7|	Ab^7, G%7, C7, Fm7, Em7, Ebm7, Ab7, Db^7, Dbm7, Gb7, Cm7, F7, Bm7, E7, Bbm7, Eb7, Cm7, F7, Bbm7, Eb7
Monk, Thelonious	Friday The 13th	G	100	Jazz-Medium Swing	TRUE	TRUE		NT	|G^7 F7|Eb7 D7|G^7 F7|Eb7 D7|G^7 F7|Eb7 D7|G^7 F7|Eb7 D7|	G^7, F7, Eb7, D7, G^7, F7, Eb7, D7, G^7, F7, Eb7, D7, G^7, F7, Eb7, D7
Evans, Bill	Funkallero	c	160	Jazz-Medium Up Swing	TRUE	TRUE		0	|D7|G7|Cm6|Cm6|D7|G7|Cm6|Cm6|Bbm7|Bbm7 Eb7|Ab^7 Db7|Cm7 Fm7|D7|G7|Cm6|Cm6|	D7, G7, Cm6, Cm6, D7, G7, Cm6, Cm6, Bbm7, Bbm7, Eb7, Ab^7, Db7, Cm7, Fm7, D7, G7, Cm6, Cm6
Morgan, Lee	Gary's Notebook	c	100	Jazz-Medium Swing	TRUE	TRUE		1	|Cm|Db7|Cm|Db7|Cm|Db7|Cm|Db7|Cm|Db7|Cm|Db7|Cm|Db7|Cm|C7|Fm6|F#7|Fm6|Fm6|Cm|Db7|Cm|Cm6|Ebm7|Ab7|Dm7|G7|Cm|Db7|Cm|Db7|	Cm, Db7, Cm, Db7, Cm, Db7, Cm, Db7, Cm, Db7, Cm, Db7, Cm, Db7, Cm, C7, Fm6, F#7, Fm6, Fm6, Cm, Db7, Cm, Cm6, Ebm7, Ab7, Dm7, G7, Cm, Db7, Cm, Db7
Hefti, Neal	Girl Talk	F	80	Jazz-Slow Swing	TRUE	TRUE		-1	|F^7 B7|Bb^7 Eb7|Am7 D7|Gm7&Am7&Bb6&C7|Fm7 Bbm7|G7 C7|Am7 D7|Am7&Bbm7&Cm7&D7|G7|C7 Bbm7|Am7 Dm7|Gm7 C7|	F^7, B7, Bb^7, Eb7, Am7, D7, Gm7, Am7, Bb6, C7, Fm7, Bbm7, G7, C7, Am7, D7, Am7, Bbm7, Cm7, D7, G7, C7, Bbm7, Am7, Dm7, Gm7, C7
Rodgers, Richard	Glad To Be Unhappy	F	60	Jazz-Ballad Swing	TRUE	TRUE		0	|Gm7|Eb^7|C7|C7|Gm7|Eb7|C7|C7&F^&F7|Bb^7 Bo7|F^7|Gm7 C7|F^7|Bb^7 Bo7|F^7|Gm7 C7|F^7|Gm7|Eb^7|C7|C7|F^7 Dm7|Gm7 C7|F^7|F^7|	Gm7, Eb^7, C7, C7, Gm7, Eb7, C7, C7, F^, F7, Bb^7, Bo7, F^7, Gm7, C7, F^7, Bb^7, Bo7, F^7, Gm7, C7, F^7, Gm7, Eb^7, C7, C7, F^7, Dm7, Gm7, C7, F^7, F^7
Distel, Sacha	Good Life, The	A-	60	Jazz-Ballad Swing	TRUE	TRUE		2	|Ab^7|Ab^7|Gm7|C7|Fm7|Fm7|D%7|G7|Db^7|Gb7|Ab^7|G%7 C7|Fm7|Bb7|Bbm7|Eb7|Ab^7|Ab^7|Gm7|C7|Fm7|Fm7|D%7|G7|Db^7|Gb7|Ab^7|F7|Bbm7|Ebsus Eb7|Ab6|Bbm7 Eb7|	Ab^7, Ab^7, Gm7, C7, Fm7, Fm7, D%7, G7, Db^7, Gb7, Ab^7, G%7, C7, Fm7, Bb7, Bbm7, Eb7, Ab^7, Ab^7, Gm7, C7, Fm7, Fm7, D%7, G7, Db^7, Gb7, Ab^7, F7, Bbm7, Ebsus, Eb7, Ab6, Bbm7, Eb7
Corea, Chick	Got A Match?	d	240	Jazz-Up Tempo Swing	TRUE	TRUE		1	|Dm7|A7|Dm7|D7|Gm7|D7|Gm7|Gm7|Em7 A7|Fm7 Bb7|Eb^7|Em7 A7|Dm7|E%7 A7|Dm7|A7|	Dm7, A7, Dm7, D7, Gm7, D7, Gm7, Gm7, Em7, A7, Fm7, Bb7, Eb^7, Em7, A7, Dm7, E%7, A7, Dm7, A7
Monk, Thelonious	Hackensack	F	100	Jazz-Medium Swing	TRUE	TRUE		1	|F6|Bb7|F6|Am7 D7|Gm7|C7|F6|C7|F6|Bb7|F6|Am7 D7|Gm7|C7|F6|F6|Bb7|Bo7|F6|Am7 D7|G7|G7|C7|Db7|F6|Bb7|F6|Am7 D7|Gm7|C7|F6|C7|	F6, Bb7, F6, Am7, D7, Gm7, C7, F6, C7, F6, Bb7, F6, Am7, D7, Gm7, C7, F6, F6, Bb7, Bo7, F6, Am7, D7, G7, G7, C7, Db7, F6, Bb7, F6, Am7, D7, Gm7, C7, F6, C7
Davis, Miles	Half Nelson	C	240	Jazz-Up Tempo Swing	TRUE	TRUE		3	|C^7|C^7|Fm7|Bb7|C^7|C^7|Bm7 E7|Bbm7 Eb7|Ab^7|Ab^7|Am7|D7|Dm7|G7|C^7 Eb^7|Ab^7 Db^7|	C^7, C^7, Fm7, Bb7, C^7, C^7, Bm7, E7, Bbm7, Eb7, Ab^7, Ab^7, Am7, D7, Dm7, G7, C^7, Eb^7, Ab^7, Db^7
Dameron, Tadd	Hot House	C	240	Jazz-Up Tempo Swing	TRUE	TRUE		0	|G%7|C7|Fm^7|Fm^7|D%7|G7|C^7|C^7|G%7|C7|Fm^7|Fm^7|D%7|G7|C^7|C^7|Cm7|F7|Bb^7|Bb^7|Ab7|Ab7|G7|G7|G%7|C7|Fm^7|Fm^7|D%7|G7|C^7|C^7|	G%7, C7, Fm^7, Fm^7, D%7, G7, C^7, C^7, G%7, C7, Fm^7, Fm^7, D%7, G7, C^7, C^7, Cm7, F7, Bb^7, Bb^7, Ab7, Ab7, G7, G7, G%7, C7, Fm^7, Fm^7, D%7, G7, C^7, C^7
Lewis, Morgan	How High The Moon	G	100	Jazz-Medium Swing	TRUE	TRUE		NT	|G^7|G^7|Gm7|C7|F^7|F^7|Fm7|Bb7|Eb^7|A%7 D7|Gm7|A%7 D7|G^7|Em7|Am7|D7|G^7|G^7|Gm7|C7|F^7|F^7|Fm7|Bb7|Eb^7|A%7 D7|G^7|Am7 D7|Bm7 E7|Am7 D7|G6|Am7 D7|	G^7, G^7, Gm7, C7, F^7, F^7, Fm7, Bb7, Eb^7, A%7, D7, Gm7, A%7, D7, G^7, Em7, Am7, D7, G^7, G^7, Gm7, C7, F^7, F^7, Fm7, Bb7, Eb^7, A%7, D7, G^7, Am7, D7, Bm7, E7, Am7, D7, G6, Am7, D7
Reinhardt, Django	Hungaria	G	160	Jazz-Up Medium Swing	TRUE	TRUE		0	|G6|G6|Ab6|Ab6|G6|G6|E7|E7|A7|A7|D7|D7|G^|Bbo7|Am7|D7|G6|G6|Ab6|Ab6|G6|G6|E7|E7|Am7|Cm6|G^|Bbo7|Am7|D7|G6|G6|	G6, G6, Ab6, Ab6, G6, G6, E7, E7, A7, A7, D7, D7, G^, Bbo7, Am7, D7, G6, G6, Ab6, Ab6, G6, G6, E7, E7, Am7, Cm6, G^, Bbo7, Am7, D7, G6, G6
McHugh, Jimmy	I Can't Believe...You're In Love...	C	100	Jazz-Medium Swing	TRUE	TRUE		2	|F6|Bb7|C^7|D7|G7|G7|C^7|Gm7 C7|F6|Bb7|C^7|D7|G7|G7|C6 F7|C6|E7|E7|A7|A7|D7|D7|G7|G7 C7|F6|Bb7|C^7|D7|G7|G7|C^7|Gm7 C7|	F6, Bb7, C^7, D7, G7, G7, C^7, Gm7, C7, F6, Bb7, C^7, D7, G7, G7, C6, F7, C6, E7, E7, A7, A7, D7, D7, G7, G7, C7, F6, Bb7, C^7, D7, G7, G7, C^7, Gm7, C7
Styne, Jule	I Fall In Love Too Easily	E-	60	Jazz-Ballad Swing	TRUE	TRUE		1	|Fm7 Bb7|Eb^7 Ab^7|D%7 G7|Cm A7|D%7 G7|Cm7 Cm7|A%7 D7|D%7 G7|A%7 D7|G7|G%7 C7|Fm7 C7|Fm7 Abm7&Db7|G7 C7|Fm7 Bb7|Eb6 C7|	Fm7, Bb7, Eb^7, Ab^7, D%7, G7, Cm, A7, D%7, G7, Cm7, Cm7, A%7, D7, D%7, G7, A%7, D7, G7, G%7, C7, Fm7, C7, Fm7, Abm7, Db7, G7, C7, Fm7, Bb7, Eb6, C7
Porter, Cole	I Love Paris	c	100	Jazz-Medium Swing	TRUE	TRUE		2	|Cm6|Cm6|Cm6|Cm6|Cm6|Cm6|D%7|G7|D%7|G7|D%7|G7|D%7|G7|Cm6|Cm6 G7|C6|C6|C6|C6|C6|Em7 Ebo7|Dm7|G7|F6|F6|Em7|A7|Dm7|G7|C6|D%7 G7|	Cm6, Cm6, Cm6, Cm6, Cm6, Cm6, D%7, G7, D%7, G7, D%7, G7, D%7, G7, Cm6, Cm6, G7, C6, C6, C6, C6, C6, Em7, Ebo7, Dm7, G7, F6, F6, Em7, A7, Dm7, G7, C6, D%7, G7
Porter, Cole	I Love You	F	160	Jazz-Medium Up Swing	TRUE	TRUE		0	|G%7|C7|F^7|F^7|Gm7|C7|F^7|F^7|G%7|C7|F^7|Bm7 E7|A^7|Bm7 E7|A^7|A^7|Gm7|C7|F^7|F^7|A%7|D7|Gm7|C7|G%7|C7|F^7|A%7 D7|G7|C7|F6|F6|	G%7, C7, F^7, F^7, Gm7, C7, F^7, F^7, G%7, C7, F^7, Bm7, E7, A^7, Bm7, E7, A^7, A^7, Gm7, C7, F^7, F^7, A%7, D7, Gm7, C7, G%7, C7, F^7, A%7, D7, G7, C7, F6, F6
Taylor, Billy	I Wish I Knew How It Would Feel To Be Free	F	60	Jazz-Ballad Even	TRUE	TRUE		0	|F^ A7|Dm Cm7|Bb^ Csus|F^|F^ Bb^&F^|F^ C^&F^|C^ G7|C7|F^ A7|Dm Cm7|Bb^ Csus|F^ Bo7|F^ C#o7|Dm Bo7|F^ Csus|F^|	F^, A7, Dm, Cm7, Bb^, Csus, F^, F^, Bb^, F^, F^, C^, F^, C^, G7, C7, F^, A7, Dm, Cm7, Bb^, Csus, F^, Bo7, F^, C#o7, Dm, Bo7, F^, Csus, F^
Reid, Billy	I'll Close My Eyes	F	100	Jazz-Medium Swing	TRUE	TRUE		1	|F^7|F^7|E%7|A7|Dm7|G7|Cm7|F7|Bb^7|Bbm7 Eb7|F^7|F^7|B%7|E7|Am7 D7|Gm7 C7|F^7|F^7|E%7|A7|Dm7|G7|Cm7|F7|Bb^7|Bbm7 Eb7|A%7|D7|Gm7|C7|F^7|F^7|	F^7, F^7, E%7, A7, Dm7, G7, Cm7, F7, Bb^7, Bbm7, Eb7, F^7, F^7, B%7, E7, Am7, D7, Gm7, C7, F^7, F^7, E%7, A7, Dm7, G7, Cm7, F7, Bb^7, Bbm7, Eb7, A%7, D7, Gm7, C7, F^7, F^7
Palmer, Jack & Williams, Spencer	I've Found A New Baby	F	100	Jazz-Medium Swing	TRUE	TRUE		0	|Dm7|E%7 A7|Dm7|D7|G7|C7|F^7|E%7 A7|Dm7|E%7 A7|Dm7|D7|G7|C7|F^7|F^7|E7|A7|Dm7|Dm7|D7|G7|C7|E%7 A7|Dm7|E%7 A7|Dm7|D7|G7|C7|F^7|F^7|	Dm7, E%7, A7, Dm7, D7, G7, C7, F^7, E%7, A7, Dm7, E%7, A7, Dm7, D7, G7, C7, F^7, F^7, E7, A7, Dm7, Dm7, D7, G7, C7, E%7, A7, Dm7, E%7, A7, Dm7, D7, G7, C7, F^7, F^7
Palmer, Jack & Williams, Spencer	I've Found A New Baby v2	F	100	Jazz-Medium Swing	TRUE	TRUE		1	|Dm7|A7|Dm7|D7|G7|C7|F6|A7|Dm7|A7|Dm7|D7|G7|C7|F6|F6|A7|A7|Dm7|Dm7|G7|G7|C7|A7|Dm7|A7|Dm7|D7|G7|C7|F6|A7|	Dm7, A7, Dm7, D7, G7, C7, F6, A7, Dm7, A7, Dm7, D7, G7, C7, F6, F6, A7, A7, Dm7, Dm7, G7, G7, C7, A7, Dm7, A7, Dm7, D7, G7, C7, F6, A7
Gershwin, George	I've Got A Crush On You	B-	60	Jazz-Ballad Swing	TRUE	TRUE		0	|Bb^7 Dbo7|Cm7 F7|Bb^7 Dbo7|Cm7 F7|Dm7 Gm7|C7|C7|Cm7 F7|Bb^7 Dbo7|Cm7 F7|Bb^7 Dbo7|Cm7 Ebm7&Ab7|Dm7 Gm7|C7|Bb^ Gm7|C7 F7|Bb6|Cm7 F7|	Bb^7, Dbo7, Cm7, F7, Bb^7, Dbo7, Cm7, F7, Dm7, Gm7, C7, C7, Cm7, F7, Bb^7, Dbo7, Cm7, F7, Bb^7, Dbo7, Cm7, Ebm7, Ab7, Dm7, Gm7, C7, Bb^, Gm7, C7, F7, Bb6, Cm7, F7
Green, Grant	Idle Moments	c	80	Jazz-Slow Swing	TRUE	TRUE		2	|Cm Cm^7|Cm7 Cm6|Cm Cm^7|Cm7 Cm6|Cm Cm^7|Cm7 Cm6|D%7|G7|Cm Cm^7|Cm7 Cm6|D%7|G7|Cm7|Fm6|G7|Ab^7|Fm6 G7|Ab7|D%7 G7|Cm G7|	Cm, Cm^7, Cm7, Cm6, Cm, Cm^7, Cm7, Cm6, Cm, Cm^7, Cm7, Cm6, D%7, G7, Cm, Cm^7, Cm7, Cm6, D%7, G7, Cm7, Fm6, G7, Ab^7, Fm6, G7, Ab7, D%7, G7, Cm, G7
Cahn, Sammy & Chaplin, Saul	If You Ever Should Leave	C	100	Jazz-Medium Swing	TRUE	TRUE		1	|C^|C^|A7|A7|D7|D7|G7|G7|C7|C7|F^|F^|D7|D7|G7|G7|C^|C^|A7|A7|D7|G7|C^ C^|C^ C^|	C^, C^, A7, A7, D7, D7, G7, G7, C7, C7, F^, F^, D7, D7, G7, G7, C^, C^, A7, A7, D7, G7, C^, C^, C^, C^
Jobim, Antonio Carlos	If You Never Come To Me	C	140	Jazz-Bossa Nova	TRUE	TRUE	Bb^7#11 A7b9 Dm11 Db7#11	1	|C^7|B^7|Bb^7|A7|Dm7|Dm7|Fm7|Bb7|E7|A7|D7|G7|C7|F7|C^7|Db7|	C^7, B^7, Bb^7, A7, Dm7, Dm7, Fm7, Bb7, E7, A7, D7, G7, C7, F7, C^7, Db7
Wayne, Mabel	In A Little Spanish Town	G	100	Jazz-Medium Swing	TRUE	TRUE		NT	|G^7|G^7|Am7|D7|D7|D7|G6|Am7 D7|G^7|Bbo7|Am7|D7|Am7|D7|G^7|Am7 D7|G^7|G^7|Am7|D7|B7|B7|E7|E7|E7|E7|A7|Bbo7|G^7|D7|G6|Am7 D7|	G^7, G^7, Am7, D7, D7, D7, G6, Am7, D7, G^7, Bbo7, Am7, D7, Am7, D7, G^7, Am7, D7, G^7, G^7, Am7, D7, B7, B7, E7, E7, E7, E7, A7, Bbo7, G^7, D7, G6, Am7, D7
Ellington, Duke	In A Mellow Tone (In A Mellotone)	A-	100	Jazz-Medium Swing	TRUE	TRUE		3	|Bb7|Eb7|Ab6|Ab6|Ebm7|Ab7|Db^7|Db^7|Db6|Gb7|Ab6|F7|Bb7|Bb7|Eb7|F7|Bb7|Eb7|Ab6|Ab6|Ebm7|Ab7|Db^7|Db^7|Db7|Do7|Ab6|F7|Bb7|Eb7|Ab6|F7|	Bb7, Eb7, Ab6, Ab6, Ebm7, Ab7, Db^7, Db^7, Db6, Gb7, Ab6, F7, Bb7, Bb7, Eb7, F7, Bb7, Eb7, Ab6, Ab6, Ebm7, Ab7, Db^7, Db^7, Db7, Do7, Ab6, F7, Bb7, Eb7, Ab6, F7
Little, Jack & Siras, John	In A Shanty In Old Shanty Town	F	100	Jazz-Medium Swing	TRUE	TRUE		2	|F^7|A7|D7|D7|G7|Ab7|G7|G7|C7|C7|F6|F6 D7|G7|G7|Gm7|C7|F^7|A7|D7|D7|G7|Ab7|G7|G7|Bb6|Bbm6|F^7 A7|D7|Gm7|C7|F6|C7|	F^7, A7, D7, D7, G7, Ab7, G7, G7, C7, C7, F6, F6, D7, G7, G7, Gm7, C7, F^7, A7, D7, D7, G7, Ab7, G7, G7, Bb6, Bbm6, F^7, A7, D7, Gm7, C7, F6, C7
Evans, Bill	Interplay	f	130	Jazz-Medium Swing	TRUE	TRUE		0	|Fm6|Fm6|Fm6|Fm6 F7|Bbm7|Bbm7|Fm6|Fm6|Db7|C7|Fm6|G%7 C7|	Fm6, Fm6, Fm6, Fm6, F7, Bbm7, Bbm7, Fm6, Fm6, Db7, C7, Fm6, G%7, C7
Carisi, John	Israel	d	100	Jazz-Medium Swing	TRUE	TRUE		1	|Dm|Dm7|Dm6|D7|Gm7|C7|F^7|Bb^7|E%7|A7|Dm F7|Bb7 A7|	Dm, Dm7, Dm6, D7, Gm7, C7, F^7, Bb^7, E%7, A7, Dm, F7, Bb7, A7
Styne, Jule	It's Been A Long Long Time	F	100	Jazz-Medium Swing	TRUE	TRUE		2	|F^ F^7|F6|F6 F#o7|C7|Gm7 D7|Gm7 C7|Gm7 C7|F^7|F^7 A%7|D7|Gm7 Bbm6|Db7 C7|F^ F^7|Am7 D7|Gm7 Gb7|F6 Gm7&C7|	F^, F^7, F6, F6, F#o7, C7, Gm7, D7, Gm7, C7, Gm7, C7, F^7, F^7, A%7, D7, Gm7, Bbm6, Db7, C7, F^, F^7, Am7, D7, Gm7, Gb7, F6, Gm7, C7
Monk, Thelonious	Jackie-ing	B-	100	Jazz-Medium Swing	TRUE	TRUE		0	|Bb^7|Bb^7|Bb^7|Bb^7|Bb^7|Bb^7|Cm7 Fsus|Fsus|Bb^7|Bb^7|G7|Cm7 F7|Bb^7|Bb^7|Bb^7|Bb^7|	Bb^7, Bb^7, Bb^7, Bb^7, Bb^7, Bb^7, Cm7, Fsus, Fsus, Bb^7, Bb^7, G7, Cm7, F7, Bb^7, Bb^7, Bb^7, Bb^7
Ivery, Marchel	Jeannie's Song	F	100	Jazz-Medium Swing	TRUE	TRUE		0	|Gm7|C7|Gm7|C7|F^7|Bb7|Am7|Abo7|Gm7|C7|F^7|Em7 A7|D^7|A7|Dm7|G7|Gm7|C7|Gm7|C7|F^7|Bb7|Am7|Abo7|Gm7|C7|Am7|D7|Gm7|C7|F^7|F^7|	Gm7, C7, Gm7, C7, F^7, Bb7, Am7, Abo7, Gm7, C7, F^7, Em7, A7, D^7, A7, Dm7, G7, Gm7, C7, Gm7, C7, F^7, Bb7, Am7, Abo7, Gm7, C7, Am7, D7, Gm7, C7, F^7, F^7
Johnson, Eddie & Bradshaw, Tiny & Plater, Bobby	Jersey Bounce	F	160	Jazz-Medium Up Swing	TRUE	TRUE		0	|F6|F6|G7|G7|Gm7|C7|F6 Abo7|Gm7 C7|F6|F6|G7|G7|Gm7|C7|F6 Db7|F6|F7|F7|Eb7|Eb7|Db7|Db7|C7|C7|F6|F6|G7|G7|Gm7|C7|F6 Db7|F6|	F6, F6, G7, G7, Gm7, C7, F6, Abo7, Gm7, C7, F6, F6, G7, G7, Gm7, C7, F6, Db7, F6, F7, F7, Eb7, Eb7, Db7, Db7, C7, C7, F6, F6, G7, G7, Gm7, C7, F6, Db7, F6
